"Estonia";"EE-10";"51-250";"The company makes software tools for other software developers and selles and markets them.";"Yes";"Estonia";"Project Lead / Project Manager";"-99";"Expert (more than 3 years experience)";"not quoted";"quoted";"not quoted";"not quoted";"-99";"not quoted";"not quoted";"quoted";"not quoted";"not quoted";"not quoted";"-99";"quoted";"quoted";"quoted";"not quoted";"not quoted";"not quoted";"-99";"quoted";"quoted";"not quoted";"not quoted";"quoted";"not quoted";"not quoted";"not quoted";"not quoted";"not quoted";"not quoted";"not quoted";"not quoted";"quoted";"not quoted";"not quoted";"not quoted";"not quoted";"not quoted";"not quoted";"We use quantified textual requirements";"-99";"We update our product backlog.";"-99";"quoted";"not quoted";"not quoted";"-99";"not quoted";"quoted";"not quoted";"not quoted";"-99";"not quoted";"quoted";"not quoted";"not quoted";"not quoted";"not quoted";"-99";"not quoted";"not quoted";"quoted";"not quoted";"not quoted";"not quoted";"not quoted";"not quoted";"-99";"Neutral";"Neutral";"Neutral";"Neutral";"I agree";"I agree";"I agree";"I agree";"I agree";"I agree";"I agree";"I agree";"I agree";"I agree";"Neutral";"Neutral";"It is practiced but not mandatory";"quoted";"not quoted";"not quoted";"not quoted";"-99";"not quoted";"not quoted";"not quoted";"not quoted";"quoted";"not quoted";"quoted";"not quoted";"not quoted";"-99";"not quoted";"No";"-77";"-77";"-77";"-77";"-77";"-66";"-77";"-66";"I disagree";"I disagree";"Neutral";;;"Neutral";;;"I disagree";;;"I disagree";"I agree";"I agree";"I disagree";;;"I agree";"I disagree";;"I agree";;;"I agree";;"Neutral";;;"I agree";;;"I agree";;"I disagree";"Communication flaws between us and the customer";"Incomplete and / or hidden requirements";"Moving targets (changing goals, business processes and / or requirements)";"Stakeholders with difficulties in separating requirements from previously known solution designs";"Unclear / unmeasurable non-functional requirements";"Personal traits of people on the project who assume too much and double check too litt.e";"Customers doesn't know enough about software and we don't manage that risk enough because mostly we have experienced stakeholders. ";"Mostly the reason is that the business is constantly learning at the same time or changes in management.";"People don't try to think outside the box often enough.";"Boils down to experience, on both ends. Non-functional requirements are easy to miss.";"Building the wrong product.";"Incomplete product.";"If parties are on board that things are changing then the project won't have problems in term of budget, timeline etc. because everybody knows these are flexible as long as targets are moving. It will cause stress for dev team though.";"Stress in negotiations or if discovered in retrospective then non-optimal solution.";"Lots of surprises in deployment.";"Regular demos";"Experienced analyst will spot these with double checking everything and asking a lot of questions that can sound pointless at the time.";"Experienced project lead. Will boil down to managing expectations.";"Experienced analyst and project lead.";"Experienced analyst.";"quoted";"quoted";"quoted";"not quoted";"not quoted";"Can't think of anything at the moment."
"Estonia";"EE-11";"11-50";"fleep is a cloud based messaging services focused for working teams";"No";"-99";"Project Lead / Project Manager";"-99";"Experienced (1-3 years experience)";"not quoted";"not quoted";"not quoted";"quoted";"we own the product and develop it in house";"not quoted";"not quoted";"quoted";"not quoted";"not quoted";"not quoted";"-99";"not quoted";"not quoted";"quoted";"not quoted";"not quoted";"not quoted";"-99";"not quoted";"quoted";"not quoted";"not quoted";"not quoted";"not quoted";"not quoted";"not quoted";"not quoted";"not quoted";"not quoted";"not quoted";"not quoted";"not quoted";"not quoted";"not quoted";"not quoted";"not quoted";"not quoted";"not quoted";"We use non-quantified textual requirments";"-99";"We update our product backlog.";"-99";"not quoted";"not quoted";"not quoted";"-99";"quoted";"not quoted";"not quoted";"not quoted";"-99";"quoted";"not quoted";"not quoted";"not quoted";"not quoted";"not quoted";"-99";"quoted";"not quoted";"not quoted";"not quoted";"quoted";"not quoted";"not quoted";"not quoted";"-99";"Neutral";"Neutral";"Neutral";"Neutral";"Neutral";"Neutral";"Neutral";"Neutral";"Neutral";"Neutral";"Neutral";"Neutral";"Neutral";"Neutral";"Neutral";"Neutral";"No";"not quoted";"not quoted";"not quoted";"not quoted";"-99";"quoted";"not quoted";"not quoted";"not quoted";"quoted";"not quoted";"not quoted";"not quoted";"not quoted";"-99";"quoted";"No";"-77";"-77";"-77";"-77";"-77";"-66";"-77";"-66";"Neutral";"Neutral";"Neutral";"Neutral";"Neutral";"Neutral";"Neutral";"Neutral";"Neutral";"Neutral";"Neutral";"Neutral";;;;;;;;;;;;;;;;;;;;;;;"Incomplete and / or hidden requirements";"Unclear responsibilities";"Communication flaws within the project team";"Underspecified requirements that are too abstract and allow for various interpretations";"^Gold plating^ (implementation of features without corresponding requirements)";"humans are involved in the process (seriously)";"humans are involved in the process (seriously)";"humans are involved in the process (seriously)";"humans are involved in the process (seriously)";"humans are involved in the process (seriously)";"implementation takes too much time / recources";"implementation takes too much time / recources";"implementation takes too much time / recources";"implementation takes too much time / recources";"implementation takes too much time / recources";"getting work done when humans are involved, specially a group of people, is hard, no easy solution there";"getting work done when humans are involved, specially a group of people, is hard, no easy solution there";"getting work done when humans are involved, specially a group of people, is hard, no easy solution there";"getting work done when humans are involved, specially a group of people, is hard, no easy solution there";"getting work done when humans are involved, specially a group of people, is hard, no easy solution there";"quoted";"not quoted";"not quoted";"not quoted";"not quoted";"i'm not too familiar with RE but i've worked enough with people and projects within scrum and within waterfall. processes are good probably RE isnt bad either but best rule to use with processes it to use processes that you are able to follow and not to ignore human aspect in the projects where humans are involved :)"
"Estonia";"EE-12";"51-250";"High volume and reliability transaction processing.";"Yes";"Estonia";"Project Lead / Project Manager";"-99";"Expert (more than 3 years experience)";"not quoted";"quoted";"quoted";"not quoted";"-99";"not quoted";"not quoted";"quoted";"not quoted";"not quoted";"not quoted";"-99";"not quoted";"not quoted";"quoted";"quoted";"quoted";"not quoted";"-99";"quoted";"not quoted";"not quoted";"not quoted";"not quoted";"quoted";"quoted";"quoted";"not quoted";"not quoted";"not quoted";"not quoted";"not quoted";"quoted";"not quoted";"not quoted";"not quoted";"not quoted";"not quoted";"not quoted";"We use non-quantified textual requirments";"-99";"We update our product backlog.";"-99";"not quoted";"not quoted";"not quoted";"-99";"quoted";"not quoted";"not quoted";"not quoted";"-99";"quoted";"not quoted";"not quoted";"quoted";"not quoted";"not quoted";"-99";"not quoted";"not quoted";"quoted";"not quoted";"not quoted";"not quoted";"not quoted";"not quoted";"-99";"I disagree";;"Neutral";;;;;"Neutral";;"I agree";"I agree";;;;"Neutral";;"It is practiced but not mandatory";"not quoted";"not quoted";"quoted";"not quoted";"-99";"not quoted";"not quoted";"not quoted";"not quoted";"quoted";"not quoted";"not quoted";"not quoted";"not quoted";"-99";"quoted";"Yes, our project teams improve requirements engineering.";"quoted";"not quoted";"not quoted";"not quoted";"not quoted";"-99";"No, we use an internally defined (company-specific) standard for improving RE";"No particular reason. Lack of competence in external standards most likely.";;;"Neutral";;"I disagree";"I disagree";"Neutral";"I disagree";"I disagree";;;;;;;"I agree";"I agree";"I agree";;;;"I agree";"I agree";"I agree";"I agree";;;;"Neutral";;;;;;"^Gold plating^ (implementation of features without corresponding requirements)";"Communication flaws between us and the customer";"Discrepancy between high degree of innovation and need for formal acceptance of (potentially wrong / incomplete / unknown) requirements";"Time boxing / Not enough time in general";"Weak access to customer needs and / or (internal) business information";"Time pressure and lack of competence on requirement writing";"Lack of experience in translating customer needs to software requirements";"Inability to deliver innovation due to the heavyweight processes";"Business requirements entering the engineering delivery too late";"lack of resources on customer side";"Having software that sort of works to fulfill very specific needs";"Time and effort is spent on building software not meeting customer needs";"Either the formal acceptance is too strict or too loose creating incomplete software products";"Cutting corners too much to achieve expected outcomes creating low-quality software products";"Software does not meet the customer expectations on delivery (wrong functionality, missing functionality)";"Enforcing more thorough review of requirements entering the development";"Facilitating better communication and enforcing process in client communications";"None";"Getting better insight into company direction and aligning the engineering better towards future products";"Enforcing better internal business documentation";"quoted";"quoted";"not quoted";"quoted";"quoted";"-99"
"Estonia";"EE-13";"251-500";"Software and information systems consulting and development. In sectors/domains where there currently are business opportunities. I myself have participated in creating solutions for utilities, government, media.";"Yes";"Estonia";"Business Analyst";"-99";"Expert (more than 3 years experience)";"not quoted";"not quoted";"quoted";"not quoted";"-99";"quoted";"not quoted";"not quoted";"not quoted";"not quoted";"quoted";"Combination of waterfall and iterative";"quoted";"not quoted";"quoted";"quoted";"not quoted";"quoted";"investigation of documentation or systems";"not quoted";"not quoted";"quoted";"not quoted";"quoted";"not quoted";"not quoted";"not quoted";"not quoted";"not quoted";"quoted";"quoted";"not quoted";"quoted";"not quoted";"not quoted";"not quoted";"not quoted";"not quoted";"not quoted";"Other";"both of the above";"We update our product backlog.";"-99";"not quoted";"not quoted";"not quoted";"-99";"quoted";"quoted";"quoted";"not quoted";"-99";"not quoted";"not quoted";"not quoted";"not quoted";"quoted";"not quoted";"-99";"not quoted";"not quoted";"not quoted";"not quoted";"not quoted";"not quoted";"quoted";"not quoted";"-99";"-77";"-77";"-77";"-77";"-77";"-77";"-77";"-77";"-77";"-77";"-77";"-77";"-77";"-77";"-77";"-77";"-77";"-77";"-77";"-77";"-77";"-66";"-77";"-77";"-77";"-77";"-77";"-77";"-77";"-77";"-77";"-66";"-77";"No";"-77";"-77";"-77";"-77";"-77";"-66";"-77";"-66";"0";"0";"0";"0";"0";"0";"0";"0";"0";"0";"0";"0";;;"Neutral";"Neutral";"Neutral";"Neutral";"I disagree";"I disagree";;"Neutral";;;;"I disagree";"I disagree";"I disagree";"I agree";"I disagree";"I disagree";;;"I disagree";"Underspecified requirements that are too abstract and allow for various interpretations";"Time boxing / Not enough time in general";"Missing traceability";"Incomplete and / or hidden requirements";"Inconsistent requirements";"Deadlines. Lack of agreed consistent approach to using of models. Lack of RE quality management.";"Fast RE with high quality assumes very high RE competence. Unrealistic project deadlines and schedules. Lack of reliable methnods for RE work estimation.";"Lack of agreed consistent approach to using of models. No supporting tools implemented in company/project. Don't know how to do it, lack of experience with traceability.";"Lack of time. Analyst competence. Low standard of RE quality management.";"Lack of time. Analyst competence. Low standard of RE quality management.";"Developers develop according to their interpretation, which likely does not fully conform to the real need. Problems in live environment. Fixing a product that is already in use = more complex fixing.";"Need to lower RE quality to achieve deadlines. RE problems affect other areas and parameters of the project (not for the positive). Need to fight for the resources for RE.";"Change impact analysis is done  manually , may take more time, is likely not comprehensive. Less transparency in developers' work and the solution as a whole. More difficult to solve problems or do new development later.";"Problems in live environment. Fixing a product that is already in use = more complex fixing. Dealing with problems / fixing things in a hurry.";"Waste of time for asking clarifications-answering. Posiibility of errors.";"none";"none";"none";"none";"none";"quoted";"not quoted";"not quoted";"quoted";"not quoted";"We do not have a documented, repeatable RE process implemented in the company. So I did not answer the following question about the problems with the current RE process in the company.    So I would like to add that I assume part of the problem why we do not have such a process has mostly to do with:  1. There is no repeatable, robust, widely-recognized, but sufficiently lightweight RE process/methodology available. The process/methodology would also need to be flexible enough to accommodate different types of projects (tailor-made software development / package (e.g. SAP, Oracle) implementation and customization / IS or software development consulting).  2. There seems to be no  standard  in RE. Maybe the theory is not mature. There's a lot of different books, different views, certifications, etc. It is not clear what a RE specialist needs to know and have skills for. Also analysts have personal approaches/preferences - which may be due to having different levels of competence."
"Estonia";"EE-15";"2000++";"Sector: Service  Industry: Gaming activities  Software domains: Enternainement, gaming, finanical software";"Yes";"Estonia";"Requirements Engineer";"-99";"Expert (more than 3 years experience)";"not quoted";"quoted";"not quoted";"not quoted";"-99";"quoted";"not quoted";"not quoted";"not quoted";"quoted";"not quoted";"-99";"quoted";"quoted";"not quoted";"quoted";"not quoted";"not quoted";"-99";"quoted";"quoted";"quoted";"quoted";"quoted";"not quoted";"not quoted";"not quoted";"quoted";"not quoted";"not quoted";"not quoted";"not quoted";"not quoted";"not quoted";"not quoted";"not quoted";"not quoted";"not quoted";"not quoted";"We use non-quantified textual requirments";"-99";"We update our product backlog.";"-99";"quoted";"quoted";"not quoted";"-99";"not quoted";"quoted";"quoted";"not quoted";"-99";"not quoted";"quoted";"not quoted";"not quoted";"not quoted";"not quoted";"-99";"not quoted";"not quoted";"not quoted";"quoted";"quoted";"not quoted";"not quoted";"not quoted";"-99";"Neutral";;;;"I agree";;;;"I agree";;"I agree";"I agree";;;;"Neutral";"It is practiced but not mandatory";"not quoted";"quoted";"not quoted";"not quoted";"-99";"not quoted";"not quoted";"not quoted";"not quoted";"quoted";"not quoted";"not quoted";"quoted";"not quoted";"-99";"not quoted";"Yes, we improve our requirements engineering via an own business unit / role.";"quoted";"not quoted";"not quoted";"not quoted";"not quoted";"-99";"No, we use an internally defined (company-specific) standard for improving RE";"We set our own standards as it seem to be simplest and more relevant for situation at hand.";;"I disagree";;;"Neutral";"I disagree";"I disagree";;"I agree";"I disagree";"I disagree";"I disagree";"I disagree";;"I agree";"I disagree";;;;;"I agree";;;;;;;;;"I disagree";;;;;"Terminological problems";"Stakeholders with difficulties in separating requirements from previously known solution designs";"Incomplete and / or hidden requirements";"Please make a selection";"Please make a selection";"Many diverese customers with their own terminology in the same industry";"For many stakeholders it is generally easier to speak in terms of solutions than in terms on requirements. Also competing customers do not want to share the real requirements but try to assess if the solution will cover them.";"Competing customers do not want to share the real requirements.";"-66";"-66";"Causes more communication overhead and poject costs";"Causes lock-in to specific solution that eventually could be not the most suitable one";"Causes later surprises and changes in requirements.";"-66";"-66";"Speak in  customer language  externally and clarify the terminology internally. Use examples and comparisons in communication to ensure understanding.";"Provide multiple solution options to bring out the differences nad their coverage of the requirements";"Explore edge cases and scenarios during requirements engineering";"-66";"-66";"not quoted";"not quoted";"not quoted";"-77";"-77";"-"
"Estonia";"EE-16";"2000++";"Logistics";"Yes";"Estonia";"Developer";"-99";"Expert (more than 3 years experience)";"not quoted";"quoted";"not quoted";"not quoted";"-99";"quoted";"not quoted";"not quoted";"not quoted";"not quoted";"not quoted";"-99";"not quoted";"not quoted";"not quoted";"not quoted";"not quoted";"not quoted";"-99";"not quoted";"not quoted";"quoted";"not quoted";"quoted";"not quoted";"not quoted";"not quoted";"not quoted";"not quoted";"quoted";"quoted";"not quoted";"quoted";"not quoted";"not quoted";"not quoted";"not quoted";"not quoted";"not quoted";"We use quantified textual requirements";"-99";"We only work with change requests.";"-99";"quoted";"not quoted";"not quoted";"-99";"not quoted";"not quoted";"not quoted";"not quoted";"-99";"quoted";"not quoted";"not quoted";"not quoted";"quoted";"not quoted";"-99";"not quoted";"not quoted";"not quoted";"not quoted";"not quoted";"not quoted";"quoted";"not quoted";"-99";"-77";"-77";"-77";"-77";"-77";"-77";"-77";"-77";"-77";"-77";"-77";"-77";"-77";"-77";"-77";"-77";"-77";"-77";"-77";"-77";"-77";"-66";"-77";"-77";"-77";"-77";"-77";"-77";"-77";"-77";"-77";"-66";"-77";"No";"-77";"-77";"-77";"-77";"-77";"-66";"-77";"-66";"I agree";"I agree";"I agree";"I agree";"Neutral";"Neutral";"Neutral";"Neutral";"Neutral";"Neutral";"Neutral";"Neutral";"I disagree";"0";"0";"0";"0";"0";"0";"0";"0";"0";"0";"0";"0";"0";"0";"0";"0";"0";"0";"0";"0";"0";"Missing traceability";"Communication flaws between us and the customer";"Please make a selection";"Please make a selection";"Please make a selection";"-99";"-99";"-66";"-66";"-66";"-99";"-99";"-66";"-66";"-66";"-99";"-99";"-66";"-66";"-66";"quoted";"quoted";"-77";"-77";"-77";"-99"
"Finland";"FI-4";"51-250";"IT-sector. We have a web-application framework. The applications we build for others can be anything.";"Yes";"Finland";"Project Lead / Project Manager";"-99";"Experienced (1-3 years experience)";"not quoted";"quoted";"quoted";"not quoted";"-99";"not quoted";"not quoted";"quoted";"quoted";"not quoted";"not quoted";"-99";"quoted";"quoted";"not quoted";"not quoted";"quoted";"not quoted";"-99";"quoted";"quoted";"not quoted";"not quoted";"not quoted";"quoted";"quoted";"quoted";"quoted";"not quoted";"quoted";"not quoted";"not quoted";"quoted";"not quoted";"not quoted";"not quoted";"not quoted";"not quoted";"not quoted";"We use quantified textual requirements";"-99";"We update our product backlog.";"-99";"quoted";"not quoted";"not quoted";"-99";"not quoted";"not quoted";"not quoted";"not quoted";"-99";"quoted";"quoted";"not quoted";"quoted";"not quoted";"not quoted";"-99";"not quoted";"not quoted";"quoted";"not quoted";"not quoted";"not quoted";"not quoted";"not quoted";"-99";"I disagree";;"I agree";"I disagree";"Neutral";;;"Neutral";;"I agree";"Neutral";"I agree";"I agree";"I agree";"Neutral";"I agree";"No";"quoted";"not quoted";"not quoted";"not quoted";"-99";"not quoted";"quoted";"not quoted";"not quoted";"not quoted";"not quoted";"not quoted";"quoted";"not quoted";"-99";"not quoted";"No";"-77";"-77";"-77";"-77";"-77";"-66";"-77";"-66";"Neutral";"I disagree";"I disagree";"I agree";"0";"I disagree";"I disagree";;;"I disagree";"I disagree";;;;"Neutral";"I agree";"Neutral";"I disagree";"I disagree";"I agree";"I agree";;"I disagree";"I disagree";"I disagree";"Neutral";"Neutral";"I disagree";"Neutral";"Neutral";"Neutral";"Neutral";"Neutral";"I disagree";"Communication flaws between us and the customer";"Unclear responsibilities";"Incomplete and / or hidden requirements";"Inconsistent requirements";"Moving targets (changing goals, business processes and / or requirements)";"Customer does not provide PO that is constantly available, and does not understand the level of commitment required.";"Customer does not understand the responsibilities of a PO, responsibilities unclear inside customer organization";"Hidden requirements that are obvious to the customer";"Trying to plan too much into the future builds too much complexity into the requirements";"Changes and instability in the customer organization are not isolated from our process. Their problems leak through.";"After something is agreed, it has different meanings for different stakeholders";"Customer spends their time in the wrong things";"Development time wasted, PO and team time wasted on grooming";"Development time wasted, customer satisfaction";"Planning is harder, development time wasted";"Train customers better, spend 1-on-1 time in the beginning of the project, have the customer PO physically close";"Train customers better, spend 1-on-1 time in the beginning of the project, have the customer PO physically close";"Spend more time with the customer, training and facilitating requirements gathering";"Spend more time with the customer, training and facilitating requirements gathering";"Spend more time with the customer, training and facilitating requirements gathering";"quoted";"quoted";"not quoted";"not quoted";"not quoted";"-99"
"Finland";"FI-6";"2000++";"Telecoms";"Yes";"Finland";"Other";"Product Owner";"Expert (more than 3 years experience)";"not quoted";"quoted";"not quoted";"not quoted";"-99";"not quoted";"not quoted";"not quoted";"not quoted";"not quoted";"quoted";"Large Scale lean & agile, 'Scrumban'";"quoted";"quoted";"quoted";"quoted";"quoted";"quoted";"standardization";"quoted";"quoted";"quoted";"quoted";"quoted";"not quoted";"not quoted";"not quoted";"not quoted";"not quoted";"not quoted";"not quoted";"not quoted";"not quoted";"not quoted";"not quoted";"not quoted";"not quoted";"not quoted";"not quoted";"We use quantified textual requirements";"-99";"We update our product backlog.";"-99";"not quoted";"quoted";"not quoted";"-99";"not quoted";"quoted";"quoted";"not quoted";"-99";"not quoted";"not quoted";"not quoted";"quoted";"not quoted";"not quoted";"-99";"not quoted";"not quoted";"not quoted";"not quoted";"not quoted";"quoted";"not quoted";"not quoted";"-99";"Neutral";"I agree";"Neutral";;;;;"I disagree";"Neutral";"I agree";"I agree";"Neutral";"Neutral";"Neutral";;"Neutral";"It is practiced but not mandatory";"not quoted";"not quoted";"not quoted";"not quoted";"-99";"quoted";"quoted";"not quoted";"not quoted";"not quoted";"not quoted";"not quoted";"not quoted";"not quoted";"-99";"quoted";"Yes, our project teams improve requirements engineering.";"not quoted";"not quoted";"not quoted";"not quoted";"quoted";"We improve continuously everything we can with the speed we can because we can";"No, we use an internally defined (company-specific) standard for improving RE";"??";"I disagree";"I disagree";"I disagree";"Neutral";"I disagree";"Neutral";"I disagree";"Neutral";"Neutral";"Neutral";"I disagree";"I disagree";"Neutral";"Neutral";"Neutral";;;"Neutral";"Neutral";;"Neutral";;"Neutral";;"Neutral";;;"Neutral";;"Neutral";;"Neutral";;;"Weak relationship to customer";"Communication flaws between us and the customer";"^Gold plating^ (implementation of features without corresponding requirements)";"Communication flaws within the project team";"Underspecified requirements that are too abstract and allow for various interpretations";"Very many customers";"Same as above";"partly same as above & ";"-99";"-99";"Doing wrong things or too much";"same";"same";"longer leadtimes, quality challenges";"longer leadtimes, quality challenges";"choosing lead customer";"same";"same";"focus on team collaboration, no formal coordinators as botle necks";"backlog grooming";"quoted";"quoted";"not quoted";"not quoted";"not quoted";"-99"
