"Ireland";"IE-8";"51-250";"2 main sectors for software applications - Credit Unions and ERP for FMCG/Drinks Industry - deployed on Oracle Application Server environment using Oracle Forms and Reports.";"No";"-99";"Business Analyst";"-99";"Expert (more than 3 years experience)";"not quoted";"quoted";"not quoted";"not quoted";"-99";"not quoted";"not quoted";"quoted";"not quoted";"not quoted";"not quoted";"-99";"not quoted";"not quoted";"not quoted";"quoted";"quoted";"not quoted";"-99";"quoted";"quoted";"quoted";"quoted";"quoted";"not quoted";"not quoted";"not quoted";"not quoted";"not quoted";"not quoted";"not quoted";"not quoted";"not quoted";"not quoted";"not quoted";"not quoted";"not quoted";"not quoted";"not quoted";"We use non-quantified textual requirments";"-99";"We regularly change the requirements specification.";"-99";"not quoted";"not quoted";"not quoted";"-99";"quoted";"quoted";"quoted";"not quoted";"-99";"not quoted";"not quoted";"quoted";"quoted";"not quoted";"not quoted";"-99";"not quoted";"not quoted";"not quoted";"quoted";"not quoted";"not quoted";"not quoted";"not quoted";"-99";"Neutral";"I agree";"I agree";"Neutral";"I agree";"I agree";"I agree";"I agree";"I agree";"I agree";"I agree";"I agree";"I disagree";"Neutral";"Neutral";"Neutral";"It is practiced but not mandatory";"quoted";"not quoted";"not quoted";"not quoted";"-99";"not quoted";"quoted";"not quoted";"not quoted";"not quoted";"not quoted";"not quoted";"quoted";"not quoted";"-99";"not quoted";"No";"-77";"-77";"-77";"-77";"-77";"-66";"-77";"-66";"I disagree";"I disagree";"I disagree";"I disagree";"I disagree";"I disagree";"I disagree";;;;;;;"Neutral";"Neutral";"I disagree";"I disagree";;;;"Neutral";"Neutral";"Neutral";"Neutral";;;;"I disagree";"Neutral";"Neutral";"I disagree";"Neutral";"Neutral";"Neutral";"Inconsistent requirements";"Weak access to customer needs and / or (internal) business information";"Insufficient support by customer";"Time boxing / Not enough time in general";"Underspecified requirements that are too abstract and allow for various interpretations";"Customer wanting tighter controls/structure and extreme flexibility at the same time";"Customer not appreciating the level of detail needed to define requirements";"Not enough detail / background info provided";"Fast paced change in customer's business environment not allowing for sufficient time to fully define requirements";"Not enough time spent defining to the level of detail required";"Difficult to meet requirements that contradict each other";"Requirements poorly defined and product unlikely to suit at first attempt";"Requirements poorly defined and product unlikely to suit at first attempt";"Rushed development and requirements/processes can be missed if not defined properly";"Requirements poorly defined and product unlikely to suit at first attempt";"Persist in trying to define exact requirements with customer";"Document gaps in understanding/requirements and try to remove them";"Document gaps in understanding/requirements and try to remove them";"Prioritise essential requirements and agree what may have to wait for a later implementation phase";"Document gaps in understanding/requirements and try to remove them";"not quoted";"not quoted";"quoted";"quoted";"not quoted";"no"
"Ireland";"IE-9";"501-1000";"We work in 4 main verticals.  UK Central Government.  Health Care, HCM, Finance and Utilities";"Yes";"UK";"Other";"Portfolio Manager";"Expert (more than 3 years experience)";"not quoted";"quoted";"not quoted";"not quoted";"-99";"quoted";"not quoted";"quoted";"quoted";"not quoted";"not quoted";"-99";"quoted";"quoted";"quoted";"quoted";"not quoted";"not quoted";"-99";"quoted";"not quoted";"quoted";"not quoted";"quoted";"not quoted";"not quoted";"not quoted";"not quoted";"not quoted";"not quoted";"quoted";"not quoted";"not quoted";"not quoted";"not quoted";"not quoted";"not quoted";"quoted";"not quoted";"Other";"Depends on project.  On Agile it is User Stories. Waterfall more formal document";"We update our product backlog.";"-99";"not quoted";"not quoted";"quoted";"We trace the Goals of the Release to User Stories. The number of the user story is use to check the code relating to it into the repository";"not quoted";"quoted";"not quoted";"not quoted";"-99";"not quoted";"quoted";"not quoted";"quoted";"not quoted";"not quoted";"-99";"not quoted";"not quoted";"quoted";"not quoted";"not quoted";"not quoted";"not quoted";"not quoted";"-99";"I disagree";"Neutral";;;;;;;"Neutral";;;;"Neutral";;"Neutral";"I agree";"It is practiced but not mandatory";"not quoted";"quoted";"quoted";"not quoted";"-99";"not quoted";"quoted";"not quoted";"not quoted";"not quoted";"not quoted";"not quoted";"quoted";"not quoted";"-99";"not quoted";"Yes, our project teams improve requirements engineering.";"not quoted";"quoted";"not quoted";"not quoted";"not quoted";"-99";"No, we use an internally defined (company-specific) standard for improving RE";"-99";"Neutral";"Neutral";"Neutral";"Neutral";"Neutral";"Neutral";"Neutral";"Neutral";"Neutral";"Neutral";"Neutral";"Neutral";;;"I agree";"Neutral";"Neutral";"Neutral";"Neutral";"Neutral";"I agree";"I agree";"Neutral";"I agree";"I agree";"I agree";;"Neutral";;"Neutral";"Neutral";"Neutral";"I agree";"I agree";"Communication flaws between us and the customer";"^Gold plating^ (implementation of features without corresponding requirements)";"Stakeholders with difficulties in separating requirements from previously known solution designs";"Unclear / unmeasurable non-functional requirements";"Moving targets (changing goals, business processes and / or requirements)";"Not getting enough access to the PO's to discuss what is being built";"Customer still have release dates but think all the users need everything at that date.  This puts additional pressure on delivery teams";"Stakeholder should be focused on goals and needs. The teams will work out the how, the stakeholder may choose and approach which is not the quickest to getting something out to the end user";"Means Non functional requirements can not be signed off";"Makes a set release date more difficult, and added pressure on delivery teams";"-99";"-99";"-99";"-99";"-99";"-99";"-99";"-99";"-99";"-99";"quoted";"not quoted";"not quoted";"not quoted";"quoted";"Getting customer's to focus on what the real goal or need for a release is for there users instead of creating products which they think the users want but are really what they want."
"Ireland";"IE-10";"251-500";"We provide software solutions for our parent company in the insurance industry.";"Yes";"NI";"Business Analyst";"-99";"Expert (more than 3 years experience)";"not quoted";"quoted";"not quoted";"not quoted";"-99";"quoted";"not quoted";"quoted";"not quoted";"not quoted";"not quoted";"-99";"quoted";"quoted";"quoted";"quoted";"not quoted";"not quoted";"-99";"quoted";"quoted";"not quoted";"not quoted";"quoted";"not quoted";"not quoted";"not quoted";"not quoted";"not quoted";"quoted";"quoted";"not quoted";"quoted";"not quoted";"not quoted";"not quoted";"not quoted";"not quoted";"not quoted";"We use non-quantified textual requirments";"-99";"We only work with change requests.";"-99";"not quoted";"quoted";"not quoted";"-99";"not quoted";"quoted";"quoted";"not quoted";"-99";"not quoted";"quoted";"quoted";"not quoted";"not quoted";"not quoted";"-99";"not quoted";"not quoted";"not quoted";"quoted";"not quoted";"quoted";"not quoted";"not quoted";"-99";;"I agree";"Neutral";"Neutral";;;"I agree";;"I agree";"I agree";"I agree";"I disagree";"I disagree";"I disagree";"I disagree";"I disagree";"No";"quoted";"quoted";"quoted";"not quoted";"-99";"not quoted";"not quoted";"quoted";"not quoted";"not quoted";"not quoted";"not quoted";"quoted";"not quoted";"-99";"not quoted";"Yes, we improve our requirements engineering via an own business unit / role.";"quoted";"not quoted";"not quoted";"not quoted";"not quoted";"-99";"Yes, we use an external standard for assessing RE (e.g., CMMI for RE)";"-99";"I disagree";"I disagree";"I disagree";"I disagree";"I disagree";"Neutral";"I disagree";"I disagree";"I disagree";"I disagree";"I disagree";"I disagree";"Neutral";;;"I agree";;;"Neutral";;;;"I agree";"I agree";;;;"I disagree";"I agree";"Neutral";;"I agree";"I agree";"I agree";"Time boxing / Not enough time in general";"Moving targets (changing goals, business processes and / or requirements)";"Volatile customer's business domain regarding, e.g., changing points of contact, business processes or requirements";"Underspecified requirements that are too abstract and allow for various interpretations";"Unclear responsibilities";"Poor estimation, insufficient access to business Subject Matter Experts, delivery dates set in advance (before estimates)";"Business/Customer not engaged and committed - have not thought the requirements through";"Business/Customer not engaged and committed - not having the business/customer role and responsibilties properly defined and adhered to";"Not enough time to flesh out requirements properly. Insufficient access to Subject Matter experts.";"Lack of process definition and adherence. Lack of commitment from all stakeholders.";"Coding will begin with poor quality requirements - potentially unclear or incomplete or wrong. Causes rework, waste and loss of morale.";"Causes rework, waste and loss of morale.";"Causes rework, waste and loss of morale.";"Coding will begin with poor quality requirements - potentially unclear or incomplete or wrong. Causes rework, waste and loss of morale. Impacts further lifecycle phases downstream - e.g. test phase";"Duplication of effort or something being missed altogether. Lack of review and sign-off process. No accountability if things go wrong. No commitment.";"If we can, we will try and reduce scope.";"Put focus on getting signed off requirements.";"Putting focus on getting signed off requirements. Encouraging knowledge transfer when resources move on and off the project.";"Use of change control. Reduce scope to later release if possible.";"Trying to get roles and responsibilities clearly defined and agreed.";"not quoted";"quoted";"not quoted";"not quoted";"not quoted";"-99"
"Ireland";"IE-12";"2000++";"The company overall is in computer hardware systems and enterprise software products  Specially I work in the eCommerce domain.";"Yes";"UK";"Requirements Engineer";"-99";"Expert (more than 3 years experience)";"not quoted";"quoted";"not quoted";"not quoted";"-99";"not quoted";"not quoted";"quoted";"not quoted";"not quoted";"not quoted";"-99";"not quoted";"quoted";"not quoted";"quoted";"not quoted";"not quoted";"-99";"quoted";"not quoted";"not quoted";"not quoted";"not quoted";"not quoted";"quoted";"not quoted";"quoted";"quoted";"not quoted";"not quoted";"not quoted";"not quoted";"not quoted";"not quoted";"not quoted";"not quoted";"not quoted";"not quoted";"We use non-quantified textual requirments";"-99";"We update our product backlog.";"-99";"not quoted";"not quoted";"quoted";"Traces between Requirements and Test Cases";"not quoted";"not quoted";"not quoted";"not quoted";"-99";"quoted";"quoted";"quoted";"quoted";"not quoted";"not quoted";"-99";"not quoted";"not quoted";"not quoted";"quoted";"quoted";"quoted";"not quoted";"not quoted";"-99";"Neutral";"I agree";;"Neutral";"I agree";"I agree";"Neutral";"Neutral";"I agree";"I agree";"I agree";;"I disagree";"Neutral";;;"It is practiced but not mandatory";"not quoted";"not quoted";"not quoted";"not quoted";"-99";"quoted";"quoted";"not quoted";"not quoted";"not quoted";"quoted";"not quoted";"not quoted";"not quoted";"-99";"not quoted";"Yes, our project teams improve requirements engineering.";"quoted";"not quoted";"not quoted";"not quoted";"not quoted";"-99";"No, we use an internally defined (company-specific) standard for improving RE";"The Business Analyst role is quite young in our area and so it is continually change to adapt to needs of our current assignment. External standards seem to be over kill at this stage.";"Neutral";"Neutral";"Neutral";"I disagree";"I disagree";;;"0";"I disagree";"I disagree";"I disagree";"Neutral";"I agree";"I agree";"Neutral";"I disagree";;"I agree";;"I agree";"Neutral";"Neutral";"Neutral";"I agree";"Neutral";"I agree";;;"I agree";"Neutral";"Neutral";;;;"Communication flaws within the project team";"Insufficient support by customer";"Weak access to customer needs and / or (internal) business information";"Moving targets (changing goals, business processes and / or requirements)";"Time boxing / Not enough time in general";"Distributed teams; one team may have people from India, UK, Boston and Seattle; No window when whole team is online at once.";"New product so no existing customer base to reach out to; Also Sales and Support of similar products is the responsiblity by teams separate to the product development team so no direct customer relationship ";"Generally there will be only 2 people working on requirements on a teams servicing a team of 5-10 dev and 2-4 QA.  Very little time to perform necessary research.";"eCommerce is a very fluid domain.  Customers' needs and demand change very quickly.";"Requirements are discussed very early on before analysis has been completed.  This means that they can sometimes have much greater impacts / complexities than first thought.";"extra meetings needed to re-iterate discussions that have already happened";"-99";"Develop products that are more technically pleasing than user friendly";"A lot of time wasted understanding and estimating work that gets descoped.";"The product backlog is used to capture small requirements that have fallen out of a previous release.  Released features are not 100% but the remaining pieces never get prioritised as they are so small.";"no mitigations";"no mitigations";"Rely heavily on the relevant domain experience of our Product Managers Business Analysts and UI designers for guidance.";"At a certain sprint in a release, items for remaining sprints are locked down and only changed if approvals across all areas are obtained.";"Have each mini feature prioritised within overall feature so that we deliver the highest priority items.  Classify each mini feature as minimum ship Vs Stretch for the feature and ensure features are only released when their min ship criteria is released.";"not quoted";"not quoted";"quoted";"quoted";"not quoted";"Hard to determine what level of detail is needed when defining requirements.  This can change significantly across teams and is usually driven by the development team as they are more abundant in numbers."
"Ireland";"IE-13";"251-500";"Software for the insurance industry.  From customer facing to internal financial reporting applications.";"Yes";"NI";"Business Analyst";"-99";"Expert (more than 3 years experience)";"not quoted";"quoted";"not quoted";"not quoted";"-99";"quoted";"not quoted";"quoted";"not quoted";"not quoted";"not quoted";"-99";"quoted";"not quoted";"quoted";"quoted";"not quoted";"not quoted";"-99";"not quoted";"not quoted";"not quoted";"not quoted";"not quoted";"not quoted";"quoted";"not quoted";"not quoted";"quoted";"quoted";"not quoted";"not quoted";"not quoted";"not quoted";"not quoted";"not quoted";"not quoted";"quoted";"not quoted";"We use quantified textual requirements";"-99";"We only work with change requests.";"-99";"not quoted";"quoted";"not quoted";"-99";"not quoted";"quoted";"quoted";"not quoted";"-99";"not quoted";"not quoted";"quoted";"not quoted";"not quoted";"not quoted";"-99";"not quoted";"not quoted";"not quoted";"not quoted";"quoted";"quoted";"not quoted";"not quoted";"-99";;"I agree";;;"Neutral";;;;;"Neutral";;"I agree";"I agree";;;;"It is practiced but not mandatory";"quoted";"not quoted";"quoted";"not quoted";"-99";"not quoted";"quoted";"not quoted";"not quoted";"not quoted";"not quoted";"not quoted";"quoted";"not quoted";"-99";"not quoted";"Yes, our project teams improve requirements engineering.";"quoted";"not quoted";"not quoted";"not quoted";"not quoted";"-99";"No, we use an internally defined (company-specific) standard for improving RE";"Currently internal review was more appropriate and probably lack of understanding as to what an external review could bring over and above internal.";;;;"Neutral";;"Neutral";;"I disagree";"I disagree";;"Neutral";"Neutral";;"Neutral";;"Neutral";;;;;"I agree";;;;"Neutral";;"Neutral";;"I agree";"Neutral";"I disagree";"Neutral";;"Neutral";"Stakeholders with difficulties in separating requirements from previously known solution designs";"Time boxing / Not enough time in general";"Moving targets (changing goals, business processes and / or requirements)";"Terminological problems";"Communication flaws between us and the customer";"Lack of understanding of actual business need";"Customer frustration";"Development team frustration";"Lack of understanding of actual business need";"Lack of understanding of actual business need";"Solution can be developed which in some cases may not be scalable and therefore involve more future investment";"Solution can be rushed";"Solution can be imcomplete";"-99";"-99";"Enforce separation of solution and need/requirement";"Replan at certain points if necessary";"Replan at certain points if necessary and or prioritise";"-99";"-99";"not quoted";"not quoted";"quoted";"not quoted";"quoted";"-99"
"Ireland";"IE-14";"51-250";"FINANCIAL SERVICES - INSURANCE";"Yes";"NORTHERN IRELAND";"Business Analyst";"-99";"Expert (more than 3 years experience)";"not quoted";"quoted";"not quoted";"not quoted";"-99";"quoted";"not quoted";"not quoted";"not quoted";"not quoted";"not quoted";"-99";"quoted";"quoted";"quoted";"quoted";"quoted";"not quoted";"-99";"quoted";"not quoted";"not quoted";"not quoted";"quoted";"quoted";"quoted";"not quoted";"quoted";"not quoted";"not quoted";"not quoted";"not quoted";"not quoted";"not quoted";"quoted";"not quoted";"not quoted";"quoted";"not quoted";"We use quantified textual requirements";"-99";"We update our product backlog.";"-99";"not quoted";"quoted";"not quoted";"-99";"not quoted";"quoted";"not quoted";"not quoted";"-99";"not quoted";"quoted";"quoted";"quoted";"quoted";"not quoted";"-99";"not quoted";"not quoted";"not quoted";"quoted";"quoted";"not quoted";"not quoted";"not quoted";"-99";"Neutral";;;"Neutral";"Neutral";;;"I agree";"I agree";;"I agree";"I agree";;"Neutral";"I agree";;"It is mandatory and practiced.";"quoted";"not quoted";"not quoted";"not quoted";"-99";"not quoted";"not quoted";"quoted";"not quoted";"not quoted";"quoted";"not quoted";"not quoted";"not quoted";"-99";"not quoted";"Yes, we improve our requirements engineering via an own business unit / role.";"quoted";"not quoted";"not quoted";"quoted";"not quoted";"-99";"Yes, we use an external standard for assessing RE (e.g., CMMI for RE)";"-99";"I disagree";"I disagree";"I disagree";"I disagree";;;;"I disagree";"I disagree";"I disagree";"I disagree";"I disagree";"Neutral";;"I disagree";"I disagree";;;"I agree";"I disagree";"Neutral";;"I disagree";;"Neutral";"Neutral";"I disagree";"I disagree";"I disagree";;"I disagree";"I disagree";"I disagree";;"Communication flaws between us and the customer";"Weak access to customer needs and / or (internal) business information";"Discrepancy between high degree of innovation and need for formal acceptance of (potentially wrong / incomplete / unknown) requirements";"Underspecified requirements that are too abstract and allow for various interpretations";"Incomplete and / or hidden requirements";"TIME ZONES";"MULTIPLE LOCATIONS";"GAPS BETWEEN INITIAL HIGH LEVEL DESIGN AND WAHTS FEASIBLE IN TIMEFRAMES";"USE OF SEMI AGILE APPROACH";"POOR UNDERSTANDING BY THE BA";"DESIGN GAPS";"DESGIN GAPS";"DESIGN GAPS";"DESIGN GAPS";"REWORK POST IMP";"SCRUMS";"MULTIPLE WORKSHOPS";"CHANGE CONTROL";"DETAILED WIREFRAMES";"BUSINESS REQUIREMENTS REVIEW AND SIGN-OFF";"not quoted";"quoted";"not quoted";"not quoted";"not quoted";"-99"
"Ireland";"IE-15";"51-250";"Software development company producing software for major capital projects";"Yes";"Northern Ireland";"Other";"Head of Development";"Expert (more than 3 years experience)";"not quoted";"quoted";"not quoted";"not quoted";"-99";"not quoted";"not quoted";"quoted";"not quoted";"not quoted";"not quoted";"-99";"quoted";"quoted";"quoted";"quoted";"not quoted";"not quoted";"-99";"not quoted";"not quoted";"not quoted";"not quoted";"not quoted";"not quoted";"not quoted";"not quoted";"not quoted";"not quoted";"quoted";"quoted";"quoted";"quoted";"quoted";"not quoted";"not quoted";"not quoted";"not quoted";"not quoted";"Other";"USer Story Acceptance Criteria";"We update our product backlog.";"-99";"quoted";"quoted";"quoted";"Traces between requirements and tests";"not quoted";"quoted";"quoted";"not quoted";"-99";"not quoted";"quoted";"quoted";"quoted";"not quoted";"not quoted";"-99";"not quoted";"not quoted";"quoted";"not quoted";"not quoted";"not quoted";"not quoted";"not quoted";"-99";"Neutral";"I agree";;"I disagree";;;"I agree";;;;;"Neutral";;"I disagree";;;"It is mandatory but not practiced.";"quoted";"not quoted";"not quoted";"not quoted";"-99";"not quoted";"quoted";"not quoted";"not quoted";"not quoted";"quoted";"not quoted";"not quoted";"not quoted";"-99";"not quoted";"Yes, our project teams improve requirements engineering.";"not quoted";"not quoted";"not quoted";"not quoted";"quoted";"To ensure we are cost effecitive and solving the only the most valuable problems";"No, we use an internally defined (company-specific) standard for improving RE";"-99";"Neutral";"Neutral";;;"Neutral";;;;;;;"I disagree";;"I agree";"Neutral";"0";"0";;"Neutral";;;;"Neutral";;;;;"Neutral";"Neutral";;"Neutral";"Neutral";"Neutral";;"Weak access to customer needs and / or (internal) business information";"Weak knowledge of customer's application domain";"Communication flaws between us and the customer";"Inconsistent requirements";"^Gold plating^ (implementation of features without corresponding requirements)";"Difficult to get access to suitably diverse set of customers";"The domain is not readily understood and needs access to experienced people";"Development team tend to have proxy access to customer and therefore things get lost in translation";"Changes or new thoughts can change requirements ";"Lack of understanding what real problem is or individuals pet ideas";"Work on the wrong problem or not the root problem";"Work on the wrong problem or not the root problem";"Work on the wrong problem or not the root problem";"Result in unnecessary change";"Not working on solving the most valuable problems";"-99";"-99";"-99";"-99";"-99";"quoted";"not quoted";"quoted";"not quoted";"not quoted";"-99"
"Ireland";"IE-16";"2000++";"Finance/Banking - institutional finance";"Yes";"UK";"Project Lead / Project Manager";"-99";"Expert (more than 3 years experience)";"not quoted";"quoted";"not quoted";"not quoted";"-99";"quoted";"not quoted";"not quoted";"not quoted";"not quoted";"not quoted";"-99";"not quoted";"quoted";"not quoted";"not quoted";"not quoted";"not quoted";"-99";"not quoted";"not quoted";"not quoted";"not quoted";"not quoted";"not quoted";"not quoted";"not quoted";"not quoted";"not quoted";"not quoted";"not quoted";"not quoted";"not quoted";"not quoted";"not quoted";"quoted";"not quoted";"not quoted";"quoted";"Other";"Not always gathered";"We regularly change the requirements specification.";"-99";"not quoted";"quoted";"not quoted";"-99";"not quoted";"not quoted";"quoted";"not quoted";"-99";"not quoted";"quoted";"quoted";"not quoted";"not quoted";"not quoted";"-99";"not quoted";"not quoted";"not quoted";"not quoted";"quoted";"not quoted";"not quoted";"not quoted";"-99";"0";"I agree";"I agree";"0";"0";"0";;;"Neutral";;;"Neutral";"Neutral";;"I disagree";;"It is practiced but not mandatory";"not quoted";"quoted";"not quoted";"not quoted";"-99";"not quoted";"not quoted";"not quoted";"not quoted";"quoted";"not quoted";"not quoted";"not quoted";"not quoted";"-99";"quoted";"No";"-77";"-77";"-77";"-77";"-77";"-66";"-77";"-66";;;;;;"Neutral";;;;;;;;;"I agree";;"I agree";"I agree";;;;;;;"Neutral";;;;"Neutral";;"Neutral";;"I agree";;"Weak knowledge of customer's application domain";"Incomplete and / or hidden requirements";"Moving targets (changing goals, business processes and / or requirements)";"Discrepancy between high degree of innovation and need for formal acceptance of (potentially wrong / incomplete / unknown) requirements";"Unclear / unmeasurable non-functional requirements";"-99";"-99";"-99";"-99";"-99";"-99";"-99";"-99";"-99";"-99";"-99";"-99";"-99";"-99";"-99";"quoted";"not quoted";"not quoted";"not quoted";"not quoted";"-99"
