"Brazil";"BR-67";"11-50";"O core da empresa está baseado em:  - Serviços de implantação e licenciamento de produto de gestão integrada para pequenas e médias empresas com ênfase no comércio varejista. O produto foi desenvolvido e é mantido pela Inform Sistemas.    - Serviços de desenvolvimento de produtos customizados na modalidade de fábrica de software.";"No";"-99";"Outro";"Gerente do Portfólio da Fábrica de Software";"Experiente (1 a 3 anos de experiência)";"not quoted";"quoted";"not quoted";"not quoted";"-99";"quoted";"not quoted";"not quoted";"not quoted";"quoted";"not quoted";"-99";"not quoted";"not quoted";"quoted";"quoted";"not quoted";"not quoted";"-99";"not quoted";"not quoted";"quoted";"not quoted";"quoted";"not quoted";"quoted";"not quoted";"not quoted";"not quoted";"quoted";"quoted";"not quoted";"quoted";"not quoted";"not quoted";"not quoted";"not quoted";"not quoted";"not quoted";"We use quantified textual requirements";"-99";"We regularly change the requirements specification.";"-99";"quoted";"quoted";"not quoted";"-99";"not quoted";"quoted";"quoted";"not quoted";"-99";"not quoted";"not quoted";"not quoted";"quoted";"quoted";"quoted";"A rastreabilidade entre os testes e os requisitos é construída ao longo do planejamento dos testes";"not quoted";"not quoted";"not quoted";"not quoted";"quoted";"quoted";"not quoted";"not quoted";"-99";"Neutro";"Concordo";"Concordo";"Não concordo";"Neutro";"Concordo";"Concordo";"Concordo";"Concordo";"Concordo";"Concordo";"Concordo";"Neutro";"Não concordo";"Não concordo";"Não concordo";"It is mandatory and practiced.";"not quoted";"not quoted";"quoted";"not quoted";"-99";"not quoted";"not quoted";"quoted";"not quoted";"not quoted";"not quoted";"not quoted";"not quoted";"quoted";"O processo prevê adaptações e a política organizacional possibilita que outras adaptações podem ser realizadas mediante autorização da coordenação da fábrica e ciência do grupo de processos";"not quoted";"Yes, our project teams improve requirements engineering.";"quoted";"not quoted";"not quoted";"not quoted";"not quoted";"-99";"No, we use an internally defined (company-specific) standard for improving RE";"O padrão de engenharia de requisitos adotado já atende aos níveis de maturidade dos modelos MPS-SW e CMMI. Quando o padrão é melhorado, há a preocupação em garantir a aderência a estes modelos. Portanto, para incorporar as mudanças no padrão, é preciso que (i) ao menos um dos papéis envolvidos (analista de sistemas, analista de teste, desenvolvedores/testadores, arquiteto, líder de projeto) perceba a mudança como melhoria; e (ii) que não haja perda de qualquer outra perspectiva (maior dificuldade, mais esforço, maior risco) ou que haja uma compensação significativa que justifique a introdução da mudança.";"Neutro";;"Não concordo";;;"Neutro";;;"Neutro";;;"Não concordo";"Não concordo";"Neutro";"Neutro";"Não concordo";"Concordo";"Concordo";;;;"Neutro";;"Neutro";"Não concordo";;"Neutro";"Neutro";"Neutro";;;"Neutro";"Neutro";;"Especificação incompleta / Requisitos implícitos não explicitados";"Domínio de negócio do cliente volátil com respeito a, e.g., mudanças nos contatos, processos de negócio ou requisitos";"Interessados com dificuldades em separar requisitos de soluções de projeto previamente conhecidas";"Requisitos pouco especificados, abstratos demais e permitindo diversas interpretações";"Requisitos voláteis (mudanças nos objetivos do sistema, processos de negócio e/ou requisitos)";"Falta de habilidades, competências e maturidade dos envolvidos; Complexidade, dinâmica e evolução do negócio do cliente;  ";"Ambiente de negócio competitivo;";"Garantir que o produto final tenha incorporado características de soluções concorrentes ou que são líderes em seus segmentos";"Falta de habilidades, competências e maturidade dos envolvidos; Urgência imposta pelo cliente / pressão de cronograma; ";"Dinâmica e evolução do negócio do cliente;  ";"Retrabalho; Conflitos na homologação; Perda de qualidade; Desvio de Prazo; Aumento do Custo; Insatisfação do Cliente; ";"Sobrecarga na gerência da comunicação; Aumento do custo (relativo a comunicação); Aumento da receita (em caso de volatilidade de requisitos); Sobrecarga da equipe";"Maior custo (para o cliente) para realização de mudanças";"Retrabalho; Conflitos na homologação; Perda de qualidade; Aumento do Custo; Desvio de Prazo; Insatisfação do Cliente; ";"Aumento da receita; sobrecarga da equipe";"Prototipação; revisão técnica e reuniões de consenso";"Ciência e aceite prévio (formal) do cliente relativo à política de gerência de mudanças a ser aplicada no projeto";"Ciência e aceite prévio (formal) do cliente relativo à política de gerência de mudanças a ser aplicada no projeto";"Revisão técnica por pares mais experientes";"Ciência e aceite prévio (formal) do cliente relativo à política de gerência de mudanças a ser aplicada no projeto";"quoted";"not quoted";"not quoted";"quoted";"not quoted";"- Como combinar/desenvolver os produtos de trabalho para minimizar o custo e aumentar o ciclo de vida dos produtos. Por exemplo, há uma tendência (observada no meio agil) de integrar o processo de teste (desde o planejamento até a codificação ) com o desenvolvimento de funcionalidades propriamente dito. Abordagens como o TDD apontam nesta direção. Nestes casos os testes automatizados também servem como parte da especificação.     - Como prover mecanismos  amigáveis , de baixo custo e eficazes, para apoiar o cliente a identificar e descrever cenários;     - Como equilibrar a quantidade de níveis de abstração com os fatores custo e manutenibilidade.."
"Brazil";"BR-70";"251-500";"Empresa voltada principalmente para soluções de Governo Eletrônico";"No";"-99";"Líder de Projeto / Gerente de Projeto";"-99";"Especialista (mais de 3 anos de experiência)";"not quoted";"quoted";"not quoted";"not quoted";"-99";"not quoted";"not quoted";"not quoted";"not quoted";"not quoted";"quoted";"Gerenciamento Ágil de Projetos";"quoted";"quoted";"quoted";"not quoted";"not quoted";"not quoted";"-99";"quoted";"quoted";"not quoted";"not quoted";"quoted";"quoted";"quoted";"not quoted";"quoted";"quoted";"not quoted";"quoted";"not quoted";"quoted";"quoted";"not quoted";"not quoted";"not quoted";"not quoted";"not quoted";"We use quantified textual requirements";"-99";"We update our product backlog.";"-99";"not quoted";"quoted";"not quoted";"-99";"not quoted";"quoted";"quoted";"not quoted";"-99";"not quoted";"not quoted";"not quoted";"quoted";"not quoted";"not quoted";"-99";"not quoted";"not quoted";"quoted";"quoted";"quoted";"not quoted";"not quoted";"not quoted";"-99";"Neutro";"Concordo";"Concordo";"Concordo";"Não concordo";"Concordo";"Concordo";"Concordo";"Concordo";"Concordo";"Concordo";"Concordo";"Concordo";"Concordo";"Concordo";"Concordo";"It is mandatory but not practiced.";"quoted";"not quoted";"not quoted";"not quoted";"-99";"not quoted";"not quoted";"not quoted";"not quoted";"quoted";"quoted";"not quoted";"quoted";"not quoted";"-99";"not quoted";"No";"-77";"-77";"-77";"-77";"-77";"-66";"-77";"-66";"Não concordo";"Não concordo";"Concordo";"Concordo";"Concordo";"Concordo";"Concordo";"Concordo";"Concordo";"Concordo";"Concordo";"Concordo";"Concordo";"Concordo";"Concordo";"Concordo";"Concordo";"Concordo";"Não concordo";"Concordo";"Concordo";"Concordo";"Concordo";"Concordo";"Não concordo";"Concordo";"Não concordo";"Não concordo";"Não concordo";"Não concordo";"Não concordo";"Concordo";"Concordo";"Concordo";"Responsabilidades não claramente definidas";"Fraco acesso às necessidades do clientes e/ou informações (internas) de negócio";"Apoio insuficiente do cliente";"Falhas de comunicação internas na equipe de desenvolvimento";"Requisitos inconsistentes";"Estrutura organizacional e falta de processos claramente definidos";"Requisitos e necessidades estratégicas não disponíveis a todos no cliente ou no projeto";"Algumas vezes as necessidades estratégicas não são efetivamente apoiadas pelo seu staff e dificultam o acesso a informação";"Distância física das equipes, dentro da empresa";"Falta de rigorosa análise de impacto dos requisitos";"Retrabalho e lacunas nas atividades de desenvolvimento";"Funcionalidades não alinhadas às necessidades reais";"Funcionalidades sem possuírem a visão necessária ou com uma perspectiva incompleta";"Retrabalho ";"Retrabalho";"Elaboração de matriz de responsabilidades para os diversos papéis e tipos de atividades";"Articulação em nível estratégico para identificação de informações relevantes";"Definição de contingências para as atividades de levantamento, validação e homologação";"Estabelecimento de plano de comunicação e diminuição da escala hierarquica na tomada de decisões";"Estabelecimento de processo de gerenciamento de mudanças";"not quoted";"quoted";"quoted";"not quoted";"not quoted";"-99"
"Brazil";"BR-71";"0";"-99";"No";"-99";"0";"-99";"0";"not quoted";"not quoted";"not quoted";"not quoted";"-99";"not quoted";"not quoted";"not quoted";"not quoted";"not quoted";"not quoted";"-99";"not quoted";"not quoted";"not quoted";"not quoted";"not quoted";"not quoted";"-99";"not quoted";"not quoted";"not quoted";"not quoted";"not quoted";"not quoted";"not quoted";"not quoted";"not quoted";"not quoted";"not quoted";"not quoted";"not quoted";"not quoted";"not quoted";"not quoted";"not quoted";"not quoted";"not quoted";"not quoted";"0";"-99";"0";"-99";"not quoted";"not quoted";"not quoted";"-99";"not quoted";"not quoted";"not quoted";"not quoted";"-99";"not quoted";"not quoted";"not quoted";"not quoted";"not quoted";"not quoted";"-99";"not quoted";"not quoted";"not quoted";"not quoted";"not quoted";"not quoted";"not quoted";"not quoted";"-99";"0";"0";"0";"0";"0";"0";"0";"0";"0";"0";"0";"0";"0";"0";"0";"0";"0";"not quoted";"not quoted";"not quoted";"not quoted";"-99";"not quoted";"not quoted";"not quoted";"not quoted";"not quoted";"not quoted";"not quoted";"not quoted";"not quoted";"-99";"not quoted";"0";"not quoted";"not quoted";"not quoted";"not quoted";"not quoted";"-99";"0";"-99";"0";"0";"0";"0";"0";"0";"0";"0";"0";"0";"0";"0";"0";"0";"0";"0";"0";"0";"0";"0";"0";"0";"0";"0";"0";"0";"0";"0";"0";"0";"0";"0";"0";"0";"Por favor selecione uma das opções";"Por favor selecione uma das opções";"Por favor selecione uma das opções";"Por favor selecione uma das opções";"Por favor selecione uma das opções";"-66";"-66";"-66";"-66";"-66";"-66";"-66";"-66";"-66";"-66";"-66";"-66";"-66";"-66";"-66";"-77";"-77";"-77";"-77";"-77";"-99"
"Brazil";"BR-72";"2000++";"Desenvolvemos software e com a aquisição da Nokia passamos, também, ao desenvolvimento de hardware. Trabalhamos em diversos setores da produção de Software, incluindo aplicações móveis e aplicações na nuvem";"Yes";"Brasil";"Desenvolvedor";"-99";"Especialista (mais de 3 anos de experiência)";"not quoted";"quoted";"not quoted";"not quoted";"-99";"not quoted";"not quoted";"quoted";"not quoted";"not quoted";"not quoted";"-99";"quoted";"quoted";"quoted";"quoted";"quoted";"quoted";"Comentários de usuários em sites dos produtos e, também, comentários na loja de aplicações. Temos ainda um site no qual o usuário pode informar o que gostaria que um produto passasse a possuir.";"not quoted";"not quoted";"not quoted";"not quoted";"quoted";"not quoted";"not quoted";"not quoted";"not quoted";"quoted";"not quoted";"quoted";"not quoted";"not quoted";"not quoted";"quoted";"not quoted";"not quoted";"not quoted";"not quoted";"We use quantified textual requirements";"-99";"We update our product backlog.";"-99";"not quoted";"quoted";"not quoted";"-99";"not quoted";"quoted";"not quoted";"not quoted";"-99";"not quoted";"not quoted";"not quoted";"quoted";"not quoted";"not quoted";"-99";"not quoted";"quoted";"not quoted";"not quoted";"not quoted";"not quoted";"not quoted";"not quoted";"-99";"Concordo";"Concordo";"Concordo";"Concordo";"Concordo";;"Concordo";"Concordo";"Concordo";"Concordo";"Concordo";"Concordo";"Concordo";"Não concordo";"Não concordo";"Não concordo";"It is mandatory and practiced.";"quoted";"quoted";"not quoted";"not quoted";"-99";"not quoted";"quoted";"not quoted";"not quoted";"not quoted";"not quoted";"quoted";"not quoted";"not quoted";"-99";"not quoted";"Yes, our project teams improve requirements engineering.";"quoted";"not quoted";"not quoted";"not quoted";"not quoted";"-99";"Yes, we use an external standard for assessing RE (e.g., CMMI for RE)";"-99";"Neutro";"Neutro";"Não concordo";"Não concordo";"Não concordo";"Não concordo";"Neutro";"Não concordo";"Não concordo";"Concordo";"Não concordo";"Não concordo";"Concordo";"Concordo";"Concordo";"Concordo";"Concordo";"Concordo";"Concordo";"Neutro";"Concordo";"Neutro";"Neutro";"Neutro";"Concordo";"Não concordo";"Não concordo";"Concordo";"Não concordo";"Não concordo";"Concordo";"Concordo";"Concordo";"Concordo";"Falhas de comunicação internas na equipe de desenvolvimento";"Problemas de terminologia";"Rastreabilidade inexistente";"Requisitos voláteis (mudanças nos objetivos do sistema, processos de negócio e/ou requisitos)";"Fraco acesso às necessidades do clientes e/ou informações (internas) de negócio";"-99";"-99";"-99";"-99";"-99";"-99";"-99";"-99";"-99";"-99";"-99";"-99";"-99";"-99";"-99";"quoted";"not quoted";"not quoted";"quoted";"not quoted";"-99"
"Brazil";"BR-73";"251-500";"A CBPM – Companhia Baiana de Pesquisa Mineral - é a empresa de pesquisa e desenvolvimento do Estado da Bahia, indutora destes processos no setor mineral do estado. Sua atuação é centrada na ampliação e aprimoramento do conhecimento geológico do território baiano, na identificação e pesquisa de seus recursos minerais e no fomento ao seu aproveitamento, atraindo, para este fim, a iniciativa privada.  Dominio do Software: Geoprocessamento";"No";"-99";"Líder de Projeto / Gerente de Projeto";"-99";"Experiente (1 a 3 anos de experiência)";"not quoted";"not quoted";"quoted";"not quoted";"-99";"quoted";"not quoted";"not quoted";"not quoted";"not quoted";"not quoted";"-99";"quoted";"not quoted";"not quoted";"not quoted";"not quoted";"not quoted";"-99";"quoted";"not quoted";"not quoted";"not quoted";"quoted";"quoted";"not quoted";"not quoted";"not quoted";"quoted";"not quoted";"not quoted";"not quoted";"not quoted";"not quoted";"not quoted";"not quoted";"not quoted";"not quoted";"not quoted";"We use non-quantified textual requirments";"-99";"We only work with change requests.";"-99";"not quoted";"not quoted";"not quoted";"-99";"quoted";"not quoted";"quoted";"not quoted";"-99";"not quoted";"not quoted";"not quoted";"not quoted";"not quoted";"not quoted";"-99";"quoted";"not quoted";"not quoted";"quoted";"not quoted";"not quoted";"not quoted";"not quoted";"-99";"Concordo";"Concordo";"Concordo";"Neutro";"Neutro";"Concordo";"Concordo";"Concordo";"Concordo";"Concordo";;;;"Não concordo";"Concordo";"Concordo";"No";"quoted";"not quoted";"not quoted";"not quoted";"-99";"not quoted";"not quoted";"not quoted";"not quoted";"quoted";"not quoted";"not quoted";"not quoted";"not quoted";"-99";"quoted";"No";"-77";"-77";"-77";"-77";"-77";"-66";"-77";"-66";"Concordo";"Neutro";"Neutro";"Concordo";"Concordo";"Não concordo";"Neutro";"Concordo";"Concordo";"Concordo";"Concordo";"Concordo";"Concordo";"Não concordo";"Concordo";"Concordo";;;"Concordo";;"Concordo";;"Concordo";"Concordo";;"Neutro";"Neutro";"Não concordo";"0";"Neutro";"Neutro";;;;"Requisitos pouco especificados, abstratos demais e permitindo diversas interpretações";"Falhas de comunicação entre desenvolvedores e clientes";"Falhas de comunicação internas na equipe de desenvolvimento";"Apoio insuficiente do líder de projeto";"^Gold plating^ (implementação de funcionalidades sem que existam requisitos, ou seja, não solicitadas pelos usuários)";"Falta de Cargo Específico para um Engenheiro de Requisitos na Empresa e falta de Expertise de quem realiza o levantamento de requisitos";"Muitos canais de comunicação são abertos devido ao fator político o que atrapalha a comunicação";"Equipe de Desenvolvimento descentralizada e espalhada em diversos setores";"Questões políticas as vezes enfraquecem o poder do líder do projeto";"Devido a questões políticas solicitações de mudança chegam sem que ocorra um estudo de impacto/aprovação";"Não há uma evolução na área de engenharia de requisitos da empresa devido a ausência do cargo";"Os vários canais de comunicação toram mais complicado o gerenciamento de requisitos";"A falta de comunicação gera retrabalho";"A falta de poder atribuído dar margem a falta de gerencia adequada no levantamento de requisitos";"Retrabalho e impacto negativo desnecessário no software";"Contratar um Analista de Requisitos experiente";"Centralizar as comunicações não permitindo comunicações não oficiais";"Criar um setor(fábrica de software) colocando os profissionais envolvidos centralizados e focados";"Disseminar a cultura do líder do projeto e buscar apoio político indicando as razões e consequencias deste poder";"Criar um comitê de mudanças, rastreabilidade e gerência de requisitos";"quoted";"quoted";"not quoted";"quoted";"not quoted";"Não, a pesquisa mapeou de forma consistente o nosso cenário ADHOC"
"Brazil";"BR-74";"2000++";"comunoicação";"No";"-99";"Líder de Projeto / Gerente de Projeto";"-99";"Especialista (mais de 3 anos de experiência)";"not quoted";"quoted";"not quoted";"not quoted";"-99";"not quoted";"not quoted";"quoted";"not quoted";"not quoted";"not quoted";"-99";"not quoted";"not quoted";"quoted";"quoted";"not quoted";"not quoted";"-99";"quoted";"quoted";"quoted";"quoted";"quoted";"not quoted";"not quoted";"not quoted";"not quoted";"not quoted";"not quoted";"not quoted";"not quoted";"not quoted";"not quoted";"not quoted";"not quoted";"not quoted";"not quoted";"not quoted";"We use quantified textual requirements";"-99";"We update our product backlog.";"-99";"not quoted";"quoted";"not quoted";"-99";"not quoted";"not quoted";"not quoted";"not quoted";"-99";"quoted";"not quoted";"not quoted";"quoted";"not quoted";"not quoted";"-99";"not quoted";"not quoted";"not quoted";"not quoted";"quoted";"not quoted";"not quoted";"not quoted";"-99";"Não concordo";"Não concordo";"Não concordo";"Não concordo";"Não concordo";"Não concordo";;"Não concordo";"Não concordo";"Não concordo";;"Concordo";"Neutro";"Concordo";"Neutro";"Concordo";"No";"not quoted";"not quoted";"not quoted";"not quoted";"-99";"quoted";"not quoted";"not quoted";"not quoted";"quoted";"not quoted";"not quoted";"not quoted";"not quoted";"-99";"quoted";"Yes, our project teams improve requirements engineering.";"quoted";"not quoted";"not quoted";"not quoted";"not quoted";"-99";"No, we use an internally defined (company-specific) standard for improving RE";"Requisitos formais, não combinam com metodologias ageis.  Nosso modelo é baseado e historia de usuarios, ciclos curtos de desenvolvimento e alta capacidade de reagir a mudanças.";"Neutro";"Neutro";"Neutro";;"Neutro";"Concordo";"Concordo";;"0";;"Concordo";"Concordo";;;;;"Neutro";"Neutro";"Neutro";"Neutro";"Neutro";"Neutro";"Neutro";"Neutro";"Neutro";"Neutro";"Neutro";"Neutro";"Neutro";"Neutro";"Neutro";"Neutro";"Neutro";"Neutro";"Domínio de negócio do cliente volátil com respeito a, e.g., mudanças nos contatos, processos de negócio ou requisitos";"Falhas de comunicação entre desenvolvedores e clientes";"Falhas de comunicação internas na equipe de desenvolvimento";"Discrepância entre um alto grau de inovação e a necessidade de obter o aceite formal dos requisitos (potencialmente errados / incompletos / desconhecidos)";"Fraco relacionamento com o cliente";"falta de metodologia agil";"falta de metodologia agil";"falta de metodologia agil";"falta de metodologia agil";"falta de metodologia agil";"nosso foco é na agregação de valor e não na produção de SW";"nosso foco é na agregação de valor e não na produção de SW";"nosso foco é na agregação de valor e não na produção de SW";"nosso foco é na agregação de valor e não na produção de SW";"nosso foco é na agregação de valor e não na produção de SW";"interação entre todos os membros do time e cliente e ciclos curtos de entrega de valor";"interação entre todos os membros do time e cliente e ciclos curtos de entrega de valor";"interação entre todos os membros do time e cliente e ciclos curtos de entrega de valor";"interação entre todos os membros do time e cliente e ciclos curtos de entrega de valor";"interação entre todos os membros do time e cliente e ciclos curtos de entrega de valor";"quoted";"not quoted";"not quoted";"quoted";"not quoted";"Analise de requisitos formal é para processos com pouca agilidade e incapacidade de reagir a mudanças.  Desenvolvimento de PRODUTO não permite qualquer desas metodologias engessadas como MPS, ITIL ...  "
"Brazil";"BR-75";"1-10";"Mobile Workforce Management: Coordenação de Força Tarefa em Campo - Gestão de Equipes Tecnicas e Prestação de Serviço de TIC  Passive Agile Management Project Tool: Gerenciamento de Projetos que utilizam métodos ágeis  MRP Agile: Gestão da qualidade ISO em processos de manufatura";"No";"não se aplica";"Engenheiro de Requisitos";"-99";"Especialista (mais de 3 anos de experiência)";"not quoted";"quoted";"not quoted";"not quoted";"-99";"not quoted";"not quoted";"quoted";"not quoted";"not quoted";"not quoted";"-99";"quoted";"quoted";"quoted";"quoted";"not quoted";"not quoted";"-99";"not quoted";"not quoted";"not quoted";"not quoted";"not quoted";"quoted";"quoted";"quoted";"quoted";"quoted";"not quoted";"not quoted";"not quoted";"not quoted";"not quoted";"not quoted";"not quoted";"not quoted";"not quoted";"not quoted";"Other";"Cartões padronizados fixados no User Story Map do Projeto";"We update our product backlog.";"-99";"quoted";"not quoted";"quoted";"Rastreabilidade de requisitos, documentos do projeto, commits, código";"not quoted";"quoted";"not quoted";"quoted";"nós fazemos análise de viabilidade, risco e efeito no product backlog diante da mudança";"not quoted";"quoted";"not quoted";"not quoted";"not quoted";"not quoted";"-99";"not quoted";"not quoted";"quoted";"not quoted";"not quoted";"not quoted";"not quoted";"quoted";"um padrão definido pela técnica Product Backlog Building (PBB)";"Concordo";"Concordo";"Concordo";"Neutro";"Neutro";;;"Concordo";"Concordo";"Concordo";"Concordo";;"Concordo";"Neutro";"Concordo";;"It is mandatory and practiced.";"not quoted";"not quoted";"quoted";"not quoted";"-99";"not quoted";"quoted";"not quoted";"not quoted";"not quoted";"quoted";"not quoted";"not quoted";"not quoted";"-99";"not quoted";"Yes, our project teams improve requirements engineering.";"quoted";"not quoted";"quoted";"not quoted";"not quoted";"-99";"Yes, we use an external standard for assessing RE (e.g., CMMI for RE)";"-99";;;;;"Não concordo";"Não concordo";"Não concordo";"Não concordo";"Não concordo";"Não concordo";"Não concordo";"Não concordo";"Neutro";;"Não concordo";"Não concordo";;"Neutro";"Neutro";"Neutro";;;"Não concordo";;;"Neutro";"Neutro";"Neutro";;;;;;;"Discrepância entre um alto grau de inovação e a necessidade de obter o aceite formal dos requisitos (potencialmente errados / incompletos / desconhecidos)";"Requisitos pouco especificados, abstratos demais e permitindo diversas interpretações";"Fraco conhecimento do domínio de aplicação do cliente";"Fraco relacionamento com o cliente";"Interessados com dificuldades em separar requisitos de soluções de projeto previamente conhecidas";"Requitos inovadores sem a perspectiva da melhor forma de se implementar diante da necessidade de aceite por parte do cliente causa insatisfação";"Nem sempre a saída tecnica é bem aceita pelo cliente";"Problemas de conhecimento do dominio de aplicação causam problemas com cronograma, estimativa do esforço e custo";"Causa problemas na negociação e priorização dos requisitos";"Falta de experiencia pode impactar em elevação de custos e alargamento cronograma";"Atrazos, insatisfação do cliente, elevação de custos";"Possivel Insatisfação com os entregáveis, atrazos, elevação de custos";"Alargamento do cronograma, elevação de custos";"Problemas na comunicação do cliente com os analistas de requisitos, dificuldade na elicitação de requisitos";"elevação de custos e alargamento do cronograma";"aproximação do cliente com os analistas de requisitos, utilização de ferramental adequado para aceitação";"aproximação do cliente com os analistas de requisitos, workshop de elicitação de requisitos com o cliente, utilização de ferramental adequado para aceitação";"contratação de consultoria, aproximação do cliente com os analistas de requisitos";"Formalização dos requisitos contratados, da entrega e aceite dos produtos de software de forma mais precisa";"Contratação de consultoria, workshop de elicitação de requisitos internos";"not quoted";"quoted";"not quoted";"quoted";"not quoted";"-99"
